{
  "$schema": "./theme.schema.json",
  "name": "Gazelle Light",
  "type": "light",
  "colors": {
    "surface.background": "#e6e7e9",
    "surface.panel": "#f3f3f4",
    "surface.raised": "#ffffff",
    "surface.inset": "#d9dadd",
    "border.subtle": "#cdcfd2",
    "border.strong": "#a6a9ae",
    "section.header": "#d2d4d8",
    "section.headerText": "#1c1d1f",
    "text.primary": "#1c1d1f",
    "text.secondary": "#3f4145",
    "text.muted": "#6b6e73",
    "text.inverse": "#ffffff",
    "accent": "#1c86aa",
    "accent.text": "#ffffff",
    "focus": "#1c86aa",
    "control.background": "#dcdde0",
    "control.hover": "#cfd1d5",
    "control.active": "#c0c3c8",
    "control.text": "#1c1d1f",
    "control.disabled": "#e9eaec",
    "control.disabledText": "#9ea1a6",
    "fader.cap": "#6f8898",
    "fader.capActive": "#3c6378",
    "fader.track": "#c5c7cb",
    "knob.ring": "#c4452f",
    "state.mute": "#b8901f",
    "state.solo": "#c4452f",
    "state.read": "#2f8f4e",
    "state.write": "#c4452f",
    "state.dim": "#b89a1f",
    "state.talkback": "#c46a1a",
    "state.dryRun": "#c46a1a",
    "connection.open": "#2f8f4e",
    "connection.reconnecting": "#b8901f",
    "connection.closed": "#c4352f",
    "notice.error": "#c4352f",
    "notice.warning": "#b8901f",
    "notice.info": "#1c86aa",
    "channel.palette": ["#b5473a", "#b83d7a", "#7a4fc2", "#4a57b8", "#2f8cc4", "#26938a", "#339a5c", "#b38f2a", "#c86a22"]
  },
  "meter": {
    "gradient": [
      { "at": -60, "color": "#127a8a" },
      { "at": -24, "color": "#17a3b3" },
      { "at": -12, "color": "#22b88c" },
      { "at": -6, "color": "#c4ab22" },
      { "at": -2, "color": "#c9761f" },
      { "at": 0, "color": "#d04430" }
    ],
    "peakHold": "#d68a14",
    "clip": "#e5261c",
    "background": "#d2d4d7",
    "scale": "#6b6e73"
  }
}
