{
  "$schema": "./theme.schema.json",
  "name": "Gazelle Dark",
  "type": "dark",
  "colors": {
    "surface.background": "#1a1b1d",
    "surface.panel": "#232427",
    "surface.raised": "#2c2e32",
    "surface.inset": "#131415",
    "border.subtle": "#34363a",
    "border.strong": "#4a4c51",
    "section.header": "#35373b",
    "section.headerText": "#e6e6e6",
    "text.primary": "#e6e6e6",
    "text.secondary": "#b4b6ba",
    "text.muted": "#85878c",
    "text.inverse": "#111214",
    "accent": "#3fb6d9",
    "accent.text": "#0b1114",
    "focus": "#6cc7e6",
    "control.background": "#35373b",
    "control.hover": "#3e4045",
    "control.active": "#4b4e53",
    "control.text": "#e0e0e0",
    "control.disabled": "#28292c",
    "control.disabledText": "#65676c",
    "fader.cap": "#9fb3c0",
    "fader.capActive": "#d8e3ea",
    "fader.track": "#0f1011",
    "knob.ring": "#d9573f",
    "state.mute": "#d9b23f",
    "state.solo": "#d9573f",
    "state.read": "#4caf6a",
    "state.write": "#d9573f",
    "state.dim": "#e0c341",
    "state.talkback": "#e08a2e",
    "state.dryRun": "#e08a2e",
    "connection.open": "#4caf6a",
    "connection.reconnecting": "#e0b341",
    "connection.closed": "#d9453f",
    "notice.error": "#e5533d",
    "notice.warning": "#e0b341",
    "notice.info": "#3fb6d9",
    "channel.palette": ["#b5473a", "#b83d7a", "#7a4fc2", "#4a57b8", "#3e9fd6", "#2fa39a", "#3fae6a", "#c9a33a", "#d9782f"]
  },
  "meter": {
    "gradient": [
      { "at": -60, "color": "#178a9c" },
      { "at": -24, "color": "#1fb8c9" },
      { "at": -12, "color": "#2fd6a4" },
      { "at": -6, "color": "#d9c23b" },
      { "at": -2, "color": "#e08a2e" },
      { "at": 0, "color": "#e5533d" }
    ],
    "peakHold": "#f0a830",
    "clip": "#ff3b30",
    "background": "#0f1011",
    "scale": "#6b6d72"
  }
}
